reply,category
말티즈가 잘 먹어요  가끔    인데 미리 알려주시면 좋겠어요   봉지 샀는데  봉지가 오면 좋지만 너무 많아서 그럴때는  봉만 살껄 할때가 있어요,animal
우리집 강아지 기호성최고 사료 다른건 빨리 질리는데 이건 계속 잘 먹어요  우리집 강아지 기호성최고 사료 다른건 빨리 질리는데 이건 계속 잘 먹어요 ,animal
지인에게 추천할 의향 있고요 제품에 만족합니다  ,animal
늘 먹고있는 사료입니다 강아지가 잘먹어요    으로 잘구매했어요,animal
울집강쥐잘먹고 잘커요,animal
계속 구입하는 제품입니다 ,animal
상품이 아주 좋습니다 ,animal
저희집 강아지가 아주 잘 먹네요,animal
배송 안전하게 잘왔고 잘먹어요,animal
환장하고 잘 먹네요 재주문각입니당,animal
배송 빠르고 괜찮네요 ,animal
배송 빠르고 괜찮네요 ,animal
상품 잘 받았습니다 다음에 또 주문할게요,animal
사료를 잘안먹는애들이라  이건 간식처럼 먹어요,animal
우리집 강아지는 이 사료만 먹어요,animal
건강백서 말티즈  가격대비 좋아요   ,animal
배송도 빠르게 잘 받았습니다,animal
   일때 저렴히 득템했습니다 ,animal
좋습니다  마음에 듭니다  ,animal
가성비 좋은 상품입니다 ,animal
가성비 좋은 상품입니다 ,animal
가성비 좋은 상품입니다 ,animal
기존에 급여하던 사료에서 바꿨는데 다행히 잘먹네요,animal
사료를 잘안먹는애들이라  이건 간식처럼 먹어요,animal
울 초롱이의 최애템   건강백서 많이 많이 오래오래 판매해주세요,animal
사료입이 짤은 비숑이가 잘 먹어요 근디 너무 잘 먹어서 살이   ,animal
항상 구매하는 제품으로 너무 좋아요  항상 좋은 제품으로 행복을 주셔서 감사해요 ,animal
강아지가 항상 잘 먹어서 구매해요,animal
우리강아지가 맛있게잘먹고 입자도 적당해요,animal
우리집 강아지 매번 구입하는 사료입니다,animal
생각보다 강쥐가 잘  고 있어요,animal
세일할때 잘 샀어요,animal
전용사료라해서 믿고 구매 했네요,animal
포장상태가 잘 되어 옵니다,animal
카드   프로 할인이라 샀는데 원플러스로 한봉씩 더 왔어요 ,animal
아는집 멍멍이 사료랑같이시킨거라  키로 두개주문했는데 묶음 판매하다 남은걸 그대로 가져다주셨네요 혹시나 세일하는가싶어 주문 내역확인했더니 아니네요  담부턴 혹하게 하지마시고 그냥 따로 따로 있는걸보내주세요,animal
항상 이걸루 사료 먹이고잇어요,animal
입자가 작아서 아가들 먹기 좋아요,animal
너무너무 진짜 좋아용  ,animal
우리 아이가 잘 먹어요,animal
가격대비 매우 만족합니다 ,animal
강아지가 너무 잘 먹어요,animal
매번 이 사료만 먹어요,animal
제품 뒷면 설명서가 안 보였지만   제품이라 구입했는데 솔비톨에 소르빈산칼륨까지  절레절레   옆 단지 냥이들 줬는데 안 먹음     양재천 산책하다 만난 냥이 줬는데 엄 청 잘 먹어서 다 줌      오늘 초면인데 와서 받아먹은거 보면 진짜 취저였나 봄  캣맘분이 밥 주러 오셨다가  애 이런 애 아닌데 받아먹는다 며 놀라심  삼색아 고마워   ,animal
좋아요  맘에들어요  재구매할게요 ,animal
대기업상품이라사봤는데 잘먹어요,animal
오리젠사료보다는 덜좋아하지만 영양가 골고루먹이려고 구입했어요 입자가좀큰것도 나오면 좋게써용,animal
이마트 전용 상품이라 가격이 저렴하고 저희 강아지들이 잘 먹어요  ,animal
맛도 다양하고 용량도 넉넉해서 항상 사는 강아지 간식이에요,animal
강아지가 아주 잘 먹어요 너무 잘먹어서 걱정 ,animal
엄청잘먹어요    ,animal
애기가 잘먹어요 대용량저렴히 구입했어요,animal
정말 잘먹고 소화도 잘 되는 것 같네요 ,animal
잘먹어서 자주 주문해서 먹이고 있습니다,animal
강아지들이 많아서 이거 사는데 항상 잘먹어요,animal
항상먹이는 사료입니다 비싸긴해도 싼사료먹이면 묽은똥을싸게 계속 이걸먹이게돠요,animal
대량으로 사기 넘 좋아뇨,animal
대표이미지 좀 바꾸세요  저게 뭡니까   ,animal
아가들 사료로 제일 좋아요,animal
울집 강쥐가 늘 먹는 제품  인터넷 최저가로 구입 더 기분 좋아요 ,animal
울집 강아지가 늘 먹던 제품인지라 품질은 신뢰를 하죠   다른 몰에 비해 가격이 제일 착해서 감사합니다  ,animal
양고기 사료 잘 받았어요,animal
가격도 저렴하고 우리 댕댕이들이 잘먹어요,animal
  살 노령견인 울집 강쥐 잘 먹어요  소포장이라 신선하고 위생적이예요  가성비도 굿 입니다 ,animal
늘 주문해서 먹는 울집 댕댕이 최애 사료,animal
아주좋습니다      ,animal
유기농이라고 해서 믿고 먹입니다,animal
가격할인해서 구매잘했어요  ,animal
만족합니다 깔끔하게 잘도착했어요  강아지가 너무 좋아하네요 ,animal
기대보다 용량이 적어요,animal
댕댕이들 오리에 고구마면 너무 행복해함    ,animal
세일   조    부탁드립니다  프    ,animal
항상 재구매 하는 상품 입니다,animal
울 강아지가 너무 좋아하는 간식이라 항상 구매합니다 ,animal
평소 고구마도 잘먹고 오리고기도 잘먹어 그란간식류 찾다 요거 발견  구매후 먹이니 너무너무 잘먹네요  놀러온 옆집뭉뭉이도 거의 한봉지를 순삭하고 가심 ,animal
항상 이용하는 제품입니다   ,animal
우리집 댕댕이가 넘 좋아해요   ,animal
늘 구비하는것들입니다   ,animal
울 강쥐가 잘먹어요  배송 감사합니다 ,animal
잘 먹어서 좋아요 ,animal
아이들이 좋아라하는 간식이라 또 주문했습니다,animal
맛있어요 추천합니다 ,animal
강아지가 잘 러서좋내요오오,animal
오리고기와 고구마를 좋아해서 샀는데 소분되어있어서 맘에 들어요 그리고 너무 잘먹어서 좋네요,animal
원통형으로 판매하던것이 패키지가 바뀌었네요   비닐패키지로 포장을 세분화하면서 가격도 올랐어요   대용량에 가성비제품이어서 좋았는데 친환경에 역행하는 방향으로 바뀌어서 아쉽습니다,animal
우리 겅아지가 덩말 좋아해요,animal
우리 강아지가 넘 좋아하는 간식입니다,animal
저희 댕댕이들이 항상 좋아하는 간식입니다,animal
저렴하게 믿을수 있는 상품 쓱배송 되어 좋네요,animal
감사합니다 잘 구입했습니다   ,animal
잘 먹어서 오리맛도 구매했어요 ,animal
저희 아이들 최애 간식입니다,animal
개님이 너무좋아해요 ,animal
배송빠르고 포장도 꼼꼼해요   배송빠르고 포장도 꼼꼼해요   ,animal
강아지들이 넘 좋아하는 간식이예요  두번째 구매예요 ,animal
강아지가 너무 좋아합니다  이 간식만 꺼내면 난리가 봉지만 뜯으면 하루에 한봉지씩 다 먹으려고 해서 고민입니다 고구마도 흰가루 없이 깔끔하고 곧 또 주문하겠습니다 ,animal
강아지가 아주 좋아합니다 ,animal
아주 잘 먹습니다   ,animal
강아지가 좋아하는 간식입니다,animal
너무 잘먹어서 걱정 이예요  세일 좀 해주세요,animal
강쥐가 맛있게 먹었어요 재구매할것같아요,animal
두번째 구매입니다 정말 잘 먹어요,animal
저희 강아지  고구마가 굻어서인지 잘 안먹네요 ,animal
영양간식이라 좋아해요 ,animal
강아지가 좋아합니다  여러번 구매했어요,animal
우리 강아지가 매일 두개씩 먹는 최애 간식이예요,animal
잘먹어요 재구매합니다,animal
맛있어요 배송도빠르고좋았어요,animal
또샀어요 계속사요 계속 잘먹어요,animal
아주 잘 먹습니다 시도때도없이 너무 찾아서 문제입니다,animal
애들이 좋아해요  ,animal
조아조아쥬라좋아용 ,animal
배송도 빠르고 늘 믿고 주문하고 있습니다 배송도 빠르고 늘 믿고 주문하고 있습니다,animal
강아지들이 잘먹어서 좋아요,animal
좋아요 좋아요 좋아요,animal
강아지에게 오래 먹을수 있는 간식을 찾고 있었는데 마침 이게 보여서 주문 해봤어요   저희 강아지가 빨리 먹는 스타일이라 이건 오래 먹을수 있을거라 기대는 했지만 역시나 빨리 먹네요     그래도 넘넘 잘 먹구 개별 포장 되어 있어서 넘 좋았어요  가격도 저렴하게 잘 구매 했습니다,animal
우리강아지최애예용  대량들어있음좋겠어요,animal
자주구매해요 사용하기 좋아요,animal
강아지가 봉지까지 핥는거 처음 봤어요 ,animal
좋아요 좋아요 좋아요,animal
저렴하게 잘 샀어요  저렴하게 잘 샀어요 ,animal
우리애들은 순식간에 먹드라구요,animal
잘 먹어요 좋아요 좋아요,animal
아주 맛있게 잘 먹었습니다,animal
항상 구입하는 겁니다 좋네요,animal
울 초롱이가 젤로 좋아하는 간식,animal
집 비울때 주는 간식으로 놓고 나가면 견주외출을 반깁니다,animal
무료배송 조건 애매하게 모자랄때 우리강쥐위해서 구매하는 오리링입니다 오래 먹는다 했는데  킬로짜리 성격급한 우리집 개늠시키는 금방 먹어버리네요   ,animal
저희 강아지 최애간식입니다,animal
잘받았습니다 좋아요,animal
감사합니다 만족해요 ,animal
강쥐들이잘먹어요만족해요,animal
잘받았습니다감사합니다,animal
애기가 잘 먹어요 굿굿,animal
빠른 배송 좋아요 ,animal
오리힘줄이라서 오래 먹을 줄 알았는데 이것두 엄청 빨리 먹어버리네요 ,animal
잘 먹어서 가끔 이용해요,animal
이갈이시기에 딱좋네요 ,animal
강아지가 정말 좋아해요,animal
굿굿굿 너무 잘먹습니다 감사합니다,animal
빠른배송 아주 좋아요,animal
강아지 주려고 샀어요    ,animal
오래먹는 간식이 필요해서 구매했지만 우리 아이에겐 금방이네요     ,animal
오래먹는다하여 주문했지만    너무 금방 먹어버리네요    흑흑,animal
몇백원 모자랄때 사기 아주 좋은 간식입니다 오래먹는다고는 하는데 우리집아이는 곰방 먹어보리네요,animal
항상구매하는 제품이에요 좋아요,animal
비싸지만가끔주면잘먹어,animal
개가잘먹어서비싸긴하다,animal
오래먹는거 같아요  오리라 좋아요,animal
강아지가 잘 먹고 좋아해요,animal
맛있었어요 최고 배송도빨라요,animal
잘먹어요    금방먹지만 좋아요,animal
아이가 잘먹어요  터키츄가 똑떨어져 급하게 주문했어요,animal
오래먹는다 하는데 성격급한 우리 강쥐는 홀랑 먹어보리네요,animal
세일할때 사봤어요  씹는 맛이있나봐요    잘먹네요,animal
개기 잘먹어시구매하는,animal
항상 애용합니다 신선하고 배송도 안전하게 와서 좋아요,animal
항상 애용합니다 신선하고 배송도 안전하게 와서 좋아요,animal
산책하는 곳에 있는 멍멍이 줘보려고 주문,animal
잘 먹어요 애기가 말랑 말랑,animal
개별포장 되있어서 좋아요,animal
잘근잘근 잘씹어먹네요,animal
기호성 좋구 오래 잘먹어요,animal
저희 집 강아지가 잘 먹어요 싸고 맛나고 최고네요,animal
우리 집 강아지가 엄청 잘 먹어용     ,animal
이 가격에 이 가성비 최고임 우리 집 강아지가 엄청 잘 먹음,animal
저희 강지는 중형견이라정말 슬삭으로 먹네여,animal
좋아해여 가지고놀다가뜯다가 좋아요,animal
강아지가 잘 먹어서 좋아요 굳굳,animal
너무 너무 좋아욥 잘 먹어욥     ,animal
잘 먹어요 간식도 적당히 주는걸로,animal
애기가 잘 먹어욥 간단하게 주기 좋네여,animal
금방 먹어서 오래가지 않네요   ,animal
강아지가 잘 먹고 좋아해요,animal
저렴해서 쓱배송하면서 시켜보았어요 잘먹어요,animal
힘줄이라 오래먹을 줄 알았는데  역시나 순삭입니다 ,animal
잘 먹어서 또 사줘야 겠어요 오래 먹는건 잘 모르겠어요   순삭,animal
신나게 자기전에 하나 야무지게 먹고자요 그래서 그런지 행복하게 잠드는거 같아요   ,animal
놀러가서 강아지 간식으로 하나 샀어요,animal
댕댕이가 환장 하게 조아함,animal
순식간에 없어졌어요 ,animal
강아지가 좋아해요 개별포장이라 환경이 걱정되네요,animal
최고최고   오리보다 닭을 더좋아해서 그런가 치킨우유껌을 훨씬더 잘먹네요 둘다 잘먹지만 치킨을 더 선호해보여요   스틱껌까지 완벽하게 먹는거 보고 이것만 몇달째 사고있네요  저렴한 가격에 양도 넉넉해서  마리키우는 저에겐 아주딱맞는 간식이랍니다 ,animal
항상 구매했어요 감사합니다   ,animal
두댕댕쓰 엄청 좋아라해요 잘먹어요,animal
군식간에 해치웁니다 가성비는 최고,animal
최고예요 ,animal
강아지 껌이 떨어져서 샀어요 향이 상당히 인위적이긴 한데 강아지는 신나게 잘 먹네요 국내제조라 더 맘에 들어요,animal
물고 지나다니는데딸기냄새솔 솔  나네요  안먹고가지고놀아요  ,animal
울 댕댕이 껌 주면 비밀 장소에 숨겨 뒀다 먹어요  맛있는 향이나고 잘 먹네요  설사나 다른 증새없이 괜찮아요  양 많고,animal
너무 크고 딱딱해서 자꾸 토하네요  ,animal
기호성 좋아서 자주 구매합니다,animal
강아지가 이 껌만 찾음,animal
엄청 조아하는거같진않아용,animal
냄새가 맛있어요  역시나 잘 먹어요 ,animal
덴탈껌에 딸기향이라니 애들이 좋아해요,animal
강아지가 나름 잘멋네요 딸기,animal
이것도 평소에 잘먹는거라 쓱에도 있어서 주문했어요 ,animal
안먹는 개껌이 많은 입맛 까다로운 강쥐인데 치즈는 좋아해서 이걸로 사줘봤는데 잘먹어요  그래서 사과맛도 사줘봤는데 그건 또 안먹네요   근데 냄새를 맡아보면 딸기맛 보다 사과맛은 치즈 냄새가 별루 안나더라구요    ,animal
배송빨랐고 저렴하게 잘샀습니다 재구매 의사있습니다,animal
달콤항 향에 강아지가 좋아합니다 재구매의사 있어요 가격도 저렴해서 좋아요,animal
울 강쥐들이 넘 좋아해욤 딸기향 좋아용,animal
강아지가 좋아라 합니다,animal
강아지들이 좋아해서 종종 구매합니다,animal
실용적이고좋아요늘시킵니다,animal
강아지 껌으로 좋아요 ,animal
강아지 껌으로 매번 구매합니다,animal
강아지 껌이 떨어져서 샀어요 향이 상당히 인위적이긴 한데 강아지는 신나게 잘 먹네요 국내제조라 더 맘에 들어요,animal
급하게필요했는데좋아요,animal
가격도 저렴하고 좋아요,animal
배송빨랐고 저렴하게 잘샀습니다 재구매 의사있습니다,animal
급할땐 새벽배송으로 편리하게 받을 수 있어요  냉동식품과 같이 주문시 처음엔 언거 처럼 딱딱하니 바로 주지 마시고 말랑해지면 주세요 ,animal
가끔주는데 잘먹어요  소형견인데도 잘 씹어먹네요 ,animal
무한애정품 엄청잘먹네요,animal
딸기향 가득  울강지가 넘좋아해요,animal
울집 댕댕이가 너무 잘먹어요  맛있는 냄새가 나요 ,animal
가격도 저렴하고 좋아요,animal
텐탈꺼 잘 안먹는데 요건 잘 먹어요,animal
가격도 저렴하고 좋아요,animal
울댕댕이가 너무 잘먹어요  딸기향이 넘 좋으네요 ,animal
감사합니다 잘받았고 잘먹으니 기분이 좋네요 빠른 배송 정말 감사드립니다,animal
배송빨랐고 저렴하게 잘샀습니다 재구매 의사있습니다,animal
딸기 좋아하는 강아지들한테 딱인것같아요    저희집 강아지는 딸기 개껌을 좋아하는데 잘 먹더라구요    근데 일반 딸기보다 치즈가있어서 그건 고민해보규   매하세용,animal
저희집은 고양이 처음키우는거라 모르고사서 줬더니 잘 못먹길래 직쭉하게    로 잘라주니 엄청 작먹어여 양치 안하려고해서 이거라도 먹우니 다행이네요,animal
가격도 저렴하고 좋아요,animal
가격도 저렴하고 좋아요,animal
잘 먹이겠습니다    ,animal
맛이 좋은지 아주 잘 먹어요,animal
가격도 저렴하고 좋아요,animal
맛있게잘먹네요 크기가먹기적당해보이네 ,animal
강아지가 잘 먹어서 좋아요,animal
자주구매하는 제품이예요,animal
아이가 좋아해서 자주 구매한답니다,animal
기존에 계속 먹어왔어요,animal
가격도 저렴하고 좋아요,animal
댕댕이가 잘 먹고 좋아해요 향도 좋구요,animal
늘 사는 제품   좋아요    ,animal
아이들이 좋아할거 같아요,animal
같은거 사과덴탈만 시켰는데 이게새로 쓱배송으로 나와서 주문해봤는데 다행이도 저희 입맛까탈한 댕댕이도 잘먹네요 ,animal
자주먹진않아요 향은좋아요   ,animal
가격도 저렴하고 좋아요,animal
워낙잘먹고있어서 자주구매해요,animal
잘 먹어요  괜찮아요,animal
우리집  강아지가  잘먹는 제품     잘,animal
저희 강아지 최애 인데  지난 주 부터 품절 이네요 ,animal
강아지가 좋아하네요,animal
우리 집 견공이 아주 좋아해요  맛있나봐요,animal
우리집 이쁜 멍멍이가 엄청 잘먹어요,animal
가격도 저렴하고 좋아요,animal
아이가 꽤 잘먹어요  색다른맛이라 구매해봅니다,animal
중형견인데잘먹어요 ,animal
편리하게 자주 이용합니다 만족해요,animal
댕댕이가 좋아하는 간식입니다  이거 꾸준히 먹이면 입냄새 제거에 좋아요 ,animal
저희집 댕댕이가 유일하게 먹는 개껌이네요  딸기 사과 바나나맛 다 좋아해요,animal
강아지가 좋아해요  첨에는 약간 냄새만 맡더니 잘 먹네요 ,animal
늘 주문해서 사용하고 있는데 정말 만족합니다  배송도 빠르고 문앞까지 배송해주시니 감사합니다  ,animal
정말 정말 좋아해요 멀리서 나는 딸기향은 제가 맡아도 좋네요 가까이 맡으면 치즈꼬릿한내가 나서 개들이 더 좋아하는듯  딱딱하고 이빨로 씹으면 딱  부러지니 참고하세용,animal
저렴하게 잘구매했어요       ,animal
우리 아가가 너무 잘먹어요,animal
개껌으로 주고 있어용,animal
재구매 상품 입니다,animal
가격도 저렴하고 좋아요,animal
좋은 제품 저렴하게 구매했습니다 추천합니다  ,animal
저렴하게잘샀네요 역시행사짱,animal
강아지가 잘 먹어요,animal
좋아요 항상 주문하는 품목입니당  ,animal
좋습니다 좋구요 맛있어,animal
강아지가 너무 좋아해요,animal
가격도 저렴하고 좋아요,animal
가격도 저렴하고 좋아요,animal
좋아요  좋아요  좋아요  ,animal
잘먹습니다 딸기향이굿,animal
강아지가 너무 좋아해요,animal
강아지가 아주 좋아해요,animal
저희집 강아지가 너무 잘먹어요,animal
항상 구매하고 있습니다,animal
치석제거에 적합한 모량은 아니네뇨  고려해보세요,animal
강아지 닭 알러지있어서     눈 귀 엄청 긁고 붉게되요   그래서 소고기 황태라 주문해봤는데 말티즈 강아지 잘 먹어요  너무 많이 먹고 안먹은척 쳐다봐서 난감        만족합니다 ,animal
좋아요 좋아요    좋아요 좋아요    좋아요 좋아요,animal
황태말린거를 쇠고기롤로 되어 있어서 칭찬용 간식으로 아주 좋아요,animal
진짜 좋아해요 좀 단단 한편이라 가위로 작게 잘라 줘요,animal
  년 말티가 이 간식을 넘 좋아하네요  늘 구매하고 있어요 ,animal
애견들이 보통 황태를 좋아하는데요   게다가 소고기까지 말이해서 저희집 애견  최애 간식이예요 ,animal
황태 싫어하는 애들은 잘 안먹네요  그래도 씹는 소리도 오독오독하고 잘 먹는 애들은 잘 먹어요,animal
평소 닭고기나 오리고기는 자주먹어서 좀 물려하는 편이었는데 그냥 황태만주니 황태의 비릿한향때문인지 별로 좋아하지 않더라고요  하지만 소고기 말이랑 같이 되있는것을 주니 가리지않고 좋아하고 잘먹어서 뿌듯했습니다   살넘은 강아지인데도 별 부담없이 잘먹고 잘씹었습니다 만족하는 제품입니다 추천추천  다먹으면 다음에 또 구매할까에요,animal
아이가 너무 잘먹고 냄새는 진짜 나도 먹고싶음요,animal
딱딱해서 아이가 잘 못 먹어요    ,animal
강아지가 잘먹어요   ,animal
상품 안전하게 잘 도착했습니다 ,animal
맛이좋은지 잘먹는데 엄청딱딱하고 아이들이 삼키면 걸릴까봐 걱정되는 사이즈네요 좀 더 작거나 좀더 컷으면 좋겠어요,animal
진짜 맛있나봐요 정말 잘먹어요 매번 사먹이는데 크기도 적당해서 좋고 딱딱하지 않은거 같아요 먹고나면 황태의 냄새로 인해 양치는 필수  ,animal
우선 강아지 건강에 좋은 황태에 소고비 콤보로 되어 있고 아이가 잘먹어서 너무 좋아요   무엇보다 가성비 짱   이제 애견 간식은 트레이더스에서 구입하려구요,animal
가격에비해양이적어서금방먹네요가격대비다른제품으로구입했어요,animal
아직먹여보진않았는데 좋아할것같아요,animal
빠른배송 넘 좋으며 짱구생일선물로 줬는데 잘먹네요   ,animal
강아지가 좋아해요   ,animal
계속 상품에 열정을 보여주세요,animal
강아지 닭 알러지있어서     눈 귀 엄청 긁고 붉게되요   그래서 소고기 황태라 주문해봤는데 말티즈 강아지 잘 먹어요  너무 많이 먹고 안먹은척 쳐다봐서 난감        만족합니다 ,animal
저희집 강아지가 제일 좋아하는 간식이에요,animal
강아지가 너무 좋아해요  좀 전에도 먹었어요,animal
항상 구입하는 제품 입니다  ,animal
소고기마 이 잘 먹어요,animal
외출할때 간식 주고 나가는데 뼈같은게 없는데도 오래 먹을 수 있어서 좋네요,animal
저희집 강아지 최애 간식입니다 진짜 너무너무 좋아해요,animal
우리 강아지가 젤 좋아하는 간식이에요   빠른배송 착한가격 감사합니다  ,animal
울집 강아지가 아주 좋아하는 간식입니다  매일 하나씩 주고있어서 떨어지지않게 준비 합니다  부디 가격 올리지 마세요 ,animal
강아지가 두마리 있는데 고령견도 잘 먹는거같고  년된 개도 잘 먹어서 자주 시킵니다 ,animal
우리집 강아지들이 잘먹네여,animal
 분도 안되서 쓱싹    ,animal
자주 구입하는 제품입니다 ,animal
우리 강쥐가 너무 잘먹어요,animal
맛있게 잘먹어요 피부트러블 안생기길 바랍니다,animal
엄청 잘 먹어요   ,animal
울 강쥐 최애 간식 중 하나,animal
우리 강아지가 아주 좋아해요  ,animal
강아지가 잘 먹어요  북어가 있어서 더 좋은것같아요,animal
최고에요 많이 파세요,animal
너무맛있게잘먹어서두번째구입했습니딘,animal
강아지가 너무 좋아해요   ,animal
자주 구매하는 상품입니다 ,animal
개스키가 좋아하네요 굿,animal
딱딱한데 잘 먹긴 해요,animal
강아지가 엄청 좋아하지는 않았어요,animal
좋아요 좋아요    좋아요 좋아요   ,animal
애기가 잘먹네요 저렴하게 샀어요,animal
가격대비 품질좋아요 강지가좋아해요,animal
늘 주문하는거라 주문해요,animal
제품도 괜찮고 배송도 빨라요,animal
댕댕이 막내 너므 잘먹어요,animal
항상 구입하는 상품입니다 ,animal
우리집 강쥐가 최애간식이에요 잘 어요,animal
너무 비싸서   좋아라는합니다   ,animal
매번시키는거에여 강아지가 잘먹어요,animal
강아지 건강사료로 주문했어요  입이 짧은 아가인데 잘먹어요 ,animal
강쥐가 잘 먹는데 그렇게 좋아하지는 않어요 안 먹지는 않는데 막 달려들지는 않어요 ,animal
입자가 좀 크긴 하데 잘라서 주니 잘먹네요 다먹어가요 애견간식 황태 소고기 말이 최고,animal
생각보다 딱딱하고 그렇게 잘 먹지는 않아서 아쉽  ,animal
제품도 괜찮고 배송도 빨라요,animal
배송빠르고 포장도 꼼꼼해요   ,animal
저희집 강아지 최애 간식입니다 너무너무 좋아해요,animal
소화력이 좋아서 먹기좋아요,animal
가격대비아주만족합니다  재구매했습니다  ,animal
아이가 잘 먹어 떨어지면 재구매하려구여 ,animal
맛있어요 배송도빠르고좋았어요,animal
강아지가 잘 먹어용 안에 또 소포장 되어 있어서 깔끔하게 줄 수 있어용,animal
강아지가 너무 좋아합니다    가격대비 양이 적어서 아쉽지만요  ,animal
너무 딱딱해서 소형견은 먹기 힘들뜻 싶어요 짤라서 주세요 재구매는 먹여보고,animal
강아지가 너무 좋아하는 간식입니다  ,animal
사료 간식 먹이기 정말 힘드네요 이번 간식은 아닌것같습니다,animal
우리 댕댕이 너무 좋아해서 큰일이네요 간식통에 코를박고 자꾸 달래요,animal
